{
  "version": 1,
  "appVersion": "0.1.0",
  "sizeBudgetBytes": 8589934592,
  "sizeBudgetLabel": "3\u20138 GB",
  "lockfile": {
    "relativePath": "requirements.lock",
    "sha256": "b05c1dc945fcdcd2fb94d8c045d82a4d7062b3f1654379fa3b962bbeebe02b00"
  },
  "interpreterRelativePath": "bin/python3",
  "entries": [
    {
      "id": "llm_worker.main",
      "relativePath": "llm_worker/main.py",
      "sha256": "7979d93347a38ab3e43d3235f8afd2c26d8c14dcdda8d00feb9fdea4267e5fee"
    }
  ]
}
